title,performer,peak_pos,wks_on_chart,first_charting_year,original_performer,performer_normalized,original_performer_normalized,label,first_year_top_10_albums,first_top_10_album,precedes_first_top_10_album,tags,genre_tags_musicbrainz,top_10_1hit_wonder_album,top_10_hitmaker_album
Ricky Martin,Ricky Martin,1,67,1999,,ricky martin,,"BMG Colombia, C2Records, Columbia",1999,True,False,,,False,True
Significant Other,Limp Bizkit,1,103,1999,,limp bizkit,,"Flip Records, Interscope Records, Universal Victor, Inc.",1999,True,False,rock,rock,False,True
Forever,Puff Daddy,2,27,1999,,puff daddy,,,1999,True,False,,,False,True
Live At Luther College,Dave Matthews & Tim Reynolds,2,51,1999,,dave matthews & tim reynolds,,,1999,True,False,,,False,True
S & M,Michael Kamen Conducting The San Francisco Symphony Orchestra,2,49,1999,Metallica With Michael Kamen Conducting The San Francisco Symphony Orchestra,michael kamen conducting the san francisco symphony orchestra,,,1999,True,False,,,True,False
The Slim Shady LP,Eminem,2,105,1999,,eminem,,"Aftermath Entertainment, BMG Direct Marketing, Inc., Interscope Records",1999,True,False,hip hop,hip hop,False,True
Unleash The Dragon,Sisqo,2,60,1999,,sisqo,,,1999,True,False,,,False,True
A Little Bit Of Mambo,Lou Bega,3,47,1999,,lou bega,,"BMG France, Lautstark, RCA",1999,True,False,,,True,False
Star Wars Episode I: The Phantom Menace (Soundtrack),London Symphony Orchestra (Williams),3,16,1999,,london symphony orchestra (williams),,,1999,True,False,,,False,True
Tha Block Is Hot,Lil Wayne,3,26,1999,,lil wayne,,"Cash Money Records, Republic Records, Universal Records",1999,True,False,hip hop,hip hop,False,True
Venni Vetti Vecci,Ja Rule,3,31,1999,,ja rule,,Def Jam Recordings,1999,True,False,hip hop,hip hop,False,True
Devil Without A Cause,Kid Rock,4,111,1999,,kid rock,,"Atlantic, Lava, Top Dog Records",1999,True,False,,,False,True
Europop,Eiffel 65,4,42,1999,,eiffel 65,,"Blanco y Negro Music, Bliss Corporation, BlissCo. S.r.l.",1999,True,False,,,True,False
On How Life Is,Macy Gray,4,89,1999,,macy gray,,"Clean Slate, Epic",1999,True,False,,,True,False
Sogno,Andrea Bocelli,4,72,1999,,andrea bocelli,,"Philips, Polydor, Sugar",1999,True,False,"vocal, tenor, polydor, andrea bocelli, céline dion, eros ramazzotti, tenor vocals",,False,True
The Amazing Jeckel Brothers,Insane Clown Posse,4,18,1999,,insane clown posse,,Island,1999,True,False,,,False,True
Things Fall Apart,The Roots,4,18,1999,,the roots,,"Geffen Records, MCA Records, Okayplayer Records",1999,True,False,,,False,True
World Wrestling Federation: WWF The Music Volume 4,Jim Johnston,4,22,1999,,jim johnston,,,1999,True,False,,,False,True
100% Ginuwine,Ginuwine,5,54,1999,,ginuwine,,550 Music,1999,True,False,"hip hop, r&b","hip hop, r&b",False,True
Guerrilla Warfare,Hot Boys,5,44,1999,,hot boys,,,1999,True,False,,,True,False
The Writing's On The Wall,Destiny's Child,5,99,1999,,destiny's child,,,1999,True,False,,,False,True
Astro Lounge,Smash Mouth,6,66,1999,,smash mouth,,"BMG Direct Marketing, Inc., Interscope Records",1999,True,False,,,True,False
Back At One,Brian McKnight,7,52,1999,,brian mcknight,,"Columbia House, Motown, Universal Music",1999,True,False,,,False,True
Coming Of Age,Memphis Bleek,7,9,1999,,memphis bleek,,Roc‐A‐Fella Records,1999,True,False,,,True,False
Marc Anthony,Marc Anthony,8,83,1999,,marc anthony,,"Columbia, Sony Music",1999,True,False,"pop, latin pop","pop, latin pop",False,True
On The 6,Jennifer Lopez,8,53,1999,,jennifer lopez,,"BMG Direct Marketing, Inc., Columbia, Epic",1999,True,False,,,False,True
The Art Of Storytelling,Slick Rick,8,17,1999,,slick rick,,"Def Jam Recordings, Rush Associated Labels",1999,True,False,hip hop,hip hop,True,False
Beneath The Surface,GZA/Genius,9,10,1999,,gza/genius,,MCA Records,1999,True,False,hip hop,hip hop,True,False
Chopper City In The Ghetto,B.G.,9,42,1999,,b.g.,,Cash Money Records,1999,True,False,,,False,True
Enema Of The State,Blink-182,9,86,1999,,blink-182,,,1999,True,False,,,False,True
Immobilarity,Chef Raekwon,9,9,1999,,chef raekwon,,,1999,True,False,,,True,False
Country Grammar,Nelly,1,104,2000,,nelly,,"BMG Direct, Fo’ Reel Entertainment, Motown",2000,True,False,,,False,True
Hotshot,Shaggy,1,84,2000,,shaggy,,Geffen Records,2000,True,False,,,True,False
Kid A,Radiohead,1,28,2000,,radiohead,,"Beat Records, Capitol Records, EMI",2000,True,False,rock,rock,False,True
Voodoo,D'Angelo,1,33,2000,,d'angelo,,,2000,True,False,,,False,True
Goodfellas,504 Boyz,2,26,2000,,504 boyz,,"No Limit Records, On the Low Records, Priority Records",2000,True,False,,,True,False
My Name Is Joe,Joe,2,60,2000,,joe,,Jive,2000,True,False,,,False,True
Revelation,98 Degrees,2,24,2000,,98 degrees,,,2000,True,False,,,True,False
[Hybrid Theory],Linkin Park,2,400,2000,,linkin park,,,2000,True,False,,,False,True
I Got That Work,Big Tymers,3,29,2000,,big tymers,,"Cash Money Records, Universal Records",2000,True,False,,,False,True
Mad Season,matchbox twenty,3,77,2000,,matchbox twenty,,"Atlantic, Emblem Records, Lava",2000,True,False,,,False,True
Riding With The King,B.B. King,3,43,2000,B.B. King & Eric Clapton,b.b. king,,"Audio Fidelity, Duck Records, Reprise Records",2000,True,False,,,True,False
White Pony,Deftones,3,40,2000,,deftones,,"Maverick, Reprise Records, Rhino",2000,True,False,"metal, nu metal, alternative metal","metal, nu metal, alternative metal",False,True
Aaron's Party (Come Get It),Aaron Carter,4,67,2000,,aaron carter,,Jive,2000,True,False,,,False,True
Back For The First Time,Ludacris,4,55,2000,,ludacris,,"Def Jam South, Disturbing tha Peace",2000,True,False,"hip hop, pop rap","hip hop, pop rap",False,True
Mer De Noms,A Perfect Circle,4,51,2000,,a perfect circle,,"A Perfect Circle Entertainment, Virgin, Virgin Music Canada",2000,True,False,,,False,True
No Angel,Dido,4,69,2000,,dido,,"Arista, Arista Records, Inc., BMG",2000,True,False,,,False,True
The Notorious KIM,Lil' Kim,4,37,2000,,lil' kim,,,2000,True,False,,,False,True
Awake,Godsmack,5,52,2000,,godsmack,,"BMG Direct, Republic Records, Universal Records",2000,True,False,,,False,True
Infest,Papa Roach,5,65,2000,,papa roach,,"DreamWorks Records, Geffen Records, UMe",2000,True,False,,,False,True
Mirror Mirror,Kelly Price,5,30,2000,,kelly price,,Def Soul,2000,True,False,,,False,True
Opposite Of H2O,Drag-On,5,14,2000,,drag-on,,,2000,True,False,,,True,False
Shyne,Shyne,5,30,2000,,shyne,,"BMG, Bad Boy Entertainment, Bad Boy Records",2000,True,False,,,False,True
Unrestricted,Da Brat,5,24,2000,,da brat,,So So Def,2000,True,False,,,True,False
Who Let The Dogs Out,Baha Men,5,46,2000,,baha men,,"Artemis Records, Attic, Capitol Records",2000,True,False,,,True,False
DJ Clue Presents: Backstage -- Mixtape (Music Inspired By The Film),DJ Clue,6,11,2000,,dj clue,,,2000,True,False,,,False,True
No Name Face,Lifehouse,6,73,2000,,lifehouse,,"A&M Records, BMG Direct Marketing, Inc., DreamWorks Records",2000,True,False,,,False,True
Still I Rise,2Pac + Outlawz,6,20,2000,,2pac + outlawz,,,2000,True,False,,,True,False
"When The Smoke Clears Sixty 6, Sixty 1",Three 6 Mafia,6,23,2000,,three 6 mafia,,,2000,True,False,,,False,True
Double Wide,Uncle Kracker,7,49,2000,,uncle kracker,,"Atlantic, Lava, Top Dog Records",2000,True,False,,,True,False
Dream A Dream,Charlotte Church,7,12,2000,,charlotte church,,Sony Classical,2000,True,False,,,True,False
The Better Life,3 Doors Down,7,93,2000,,3 doors down,,"BMG Direct, Republic Records, Universal Motown",2000,True,False,alternative rock,alternative rock,False,True
Beware Of Dog,Lil Bow Wow,8,52,2000,,lil bow wow,,,2000,True,False,,,True,False
G,Gerald Levert,8,28,2000,,gerald levert,,"Atlantic, EastWest Records America, Elektra",2000,True,False,,,False,True
J.E. Heartbreak,Jagged Edge,8,74,2000,,jagged edge,,"Columbia, So So Def",2000,True,False,,,False,True
Snoop Dogg Presents Tha Eastsidaz,Tha Eastsidaz,8,31,2000,Snoop Dogg & Tha Eastsidaz,tha eastsidaz,,"Dogghouse Records, TVT Records",2000,True,False,"hip hop, gangsta rap, g-funk","hip hop, gangsta rap, g-funk",True,False
Art Official Intelligence: Mosaic Thump,De La Soul,9,12,2000,,de la soul,,"AOI Records, Tommy Boy, [no label]",2000,True,False,hip hop,hip hop,True,False
Emotional,Carl Thomas,9,49,2000,,carl thomas,,"Arista, BMG, Bad Boy Entertainment",2000,True,False,hip hop,hip hop,False,True
Songs From An American Movie Vol. One: Learning How To Smile,Everclear,9,36,2000,,everclear,,Capitol Records,2000,True,False,,,True,False
The Ecleftic: 2 Sides II A Book,Wyclef Jean,9,30,2000,,wyclef jean,,"Columbia, SME Records",2000,True,False,,,False,True
The Gift Of Game,Crazy Town,9,34,2000,,crazy town,,"BMG Direct, Columbia, SME Records",2000,True,False,"rock, rap, metal","rock, metal",True,False
Break The Cycle,Staind,1,70,2001,,staind,,"Elektra, Flip Records",2001,True,False,,,False,True
Devil's Night,D12,1,22,2001,,d12,,,2001,True,False,,,False,True
Songs In A Minor,Alicia Keys,1,70,2001,,alicia keys,,"BMG, BMG Brasil Ltda., BMG Colombia",2001,True,False,,,False,True
Toxicity,System Of A Down,1,154,2001,,system of a down,,"American Recordings, Columbia, Sony Music",2001,True,False,,,False,True
Escape,Enrique Iglesias,2,64,2001,,enrique iglesias,,Interscope Records,2001,True,False,latin pop,latin pop,False,True
Morning View,Incubus,2,60,2001,,incubus,,"BMG Direct Marketing, Inc., Epic, Epic Music Video",2001,True,False,"rock, alternative rock","rock, alternative rock",False,True
Part III,112,2,37,2001,,112,,"Arista, BMG, Bad Boy Entertainment",2001,True,False,r&b,r&b,False,True
Silver Side Up,Nickelback,2,92,2001,,nickelback,,"BMG Direct, BMG Direct Marketing, Inc., EMI Music Canada",2001,True,False,,,False,True
The Saga Continues...,The Bad Boy Family,2,19,2001,P. Diddy & The Bad Boy Family,the bad boy family,,,2001,True,False,,,True,False
"Dark Days, Bright Nights",Bubba Sparxxx,3,18,2001,,bubba sparxxx,,"Beatclub Records, Interscope Records, Newtown Music",2001,True,False,,,False,True
Eternal,Ronald Isley,3,29,2001,The Isley Brothers Featuring Ronald Isley,ronald isley,,,2001,True,False,,,False,True
Free City,St. Lunatics,3,22,2001,,st. lunatics,,"Fo’ Reel Entertainment, Republic Records, Universal",2001,True,False,hip hop,hip hop,True,False
Iowa,Slipknot,3,18,2001,,slipknot,,"AGAT Company Ltd., Roadrunner Records",2001,True,False,,,False,True
Laundry Service,Shakira,3,62,2001,,shakira,,"BMG Direct Marketing, Inc., Epic, Epic Records International",2001,True,False,,,False,True
Duces 'N Trayz--The Old Fashioned Way,Snoop Dogg Presents Tha Eastsidaz,4,13,2001,,snoop dogg presents tha eastsidaz,,,2001,True,False,,,True,False
Ghetto Fabolous,Fabolous,4,33,2001,,fabolous,,"Desert Storm Records, Elektra, Rhino Atlantic",2001,True,False,"hip hop, gangsta rap","hip hop, gangsta rap",False,True
Malpractice,Redman,4,16,2001,,redman,,"Def Jam Recordings, Def Squad",2001,True,False,,,False,True
Mista Don't Play Everythangs Workin,Project Pat,4,26,2001,,project pat,,,2001,True,False,,,True,False
Thugs Are Us,Trick Daddy,4,36,2001,,trick daddy,,"Atlantic, Slip‐N‐Slide Records",2001,True,False,,,False,True
Greatest Hits,Martina McBride,5,104,2001,,martina mcbride,,"BMG Direct Marketing, Inc., RCA",2001,True,False,country,country,False,True
Kiss Tha Game Goodbye,Jadakiss,5,14,2001,,jadakiss,,"Interscope Records, Ruff Ryders",2001,True,False,hip hop,hip hop,False,True
Live In New York City,Bruce Springsteen & The E Street Band,5,8,2001,,bruce springsteen & the e street band,,,2001,True,False,,,False,True
O-Town,O-Town,5,54,2001,,o-town,,UTC Wired,2001,True,False,,,True,False
Open Letter,Case,5,17,2001,,case,,"Def Jam Recordings, Def Soul",2001,True,False,,,True,False
Your Woman,Sunshine Anderson,5,17,2001,,sunshine anderson,,"Atlantic, Soulife Recordings",2001,True,False,,,True,False
Drops Of Jupiter,Train,6,64,2001,,train,,"Aware Records, BMG Direct Marketing, Inc., Columbia",2001,True,False,"rock, alternative rock, pop rock","rock, alternative rock, pop rock",False,True
Irresistible,Jessica Simpson,6,16,2001,,jessica simpson,,"Columbia, Sony Records International",2001,True,False,,,False,True
It Was All A Dream,Dream,6,34,2001,,dream,,"Bad Boy Entertainment, Bad Boy Records, Regime Music Group",2001,True,False,,,True,False
Lil' Romeo,Lil' Romeo,6,24,2001,,lil' romeo,,,2001,True,False,,,True,False
M!ssundaztood,P!nk,6,90,2001,,p!nk,,"Arista, BMG, BMG Japan",2001,True,False,,,False,True
Pleasures U Like,Jon B,6,13,2001,,jon b,,Epic,2001,True,False,,,True,False
Popstars,Eden's Crush,6,13,2001,,eden's crush,,,2001,True,False,,,True,False
Satellite,P.O.D.,6,71,2001,,p.o.d.,,"Atlantic, Rhino Atlantic",2001,True,False,,,False,True
Sugar Ray,Sugar Ray,6,21,2001,,sugar ray,,"Atlantic, EastWest Japan, Lava",2001,True,False,,,True,False
Force Of Nature,Tank,7,25,2001,,tank,,"Blackground Records, Virgin",2001,True,False,,,False,True
Josh Groban,Josh Groban,8,101,2001,,josh groban,,"143 Records, Reprise Records, Warner Bros. Records",2001,True,False,,,False,True
Room For Squares,John Mayer,8,95,2001,,john mayer,,"Aware Records, Columbia, Music on Vinyl",2001,True,False,,,False,True
So Blu,Blu Cantrell,8,15,2001,,blu cantrell,,Arista,2001,True,False,,,True,False
Come Clean,Puddle Of Mudd,9,88,2001,,puddle of mudd,,"BMG Direct, Flawless Records, Geffen Records",2001,True,False,,,True,False
I'm Already There,Lonestar,9,64,2001,,lonestar,,BNA Records Label,2001,True,False,,,False,True
Pull My Chain,Toby Keith,9,66,2001,,toby keith,,"DreamWorks Nashville Records, DreamWorks Records",2001,True,False,,,False,True
The Look Of Love,Diana Krall,9,53,2001,,diana krall,,"BMG Direct Marketing, Inc., Verve, Verve Music Group",2001,True,False,jazz,jazz,False,True
[Ghetto Love],Jaheim,9,68,2001,,jaheim,,,2001,True,False,,,False,True
2000 Watts,Tyrese,10,24,2001,,tyrese,,RCA,2001,True,False,,,False,True
Acoustic Soul,India.Arie,10,75,2001,,india.arie,,"BMG Direct Marketing, Inc., Motown",2001,True,False,,,False,True
The Good Times,Afroman,10,19,2001,,afroman,,"T-Bones Records, Universal Records",2001,True,False,,,True,False
Ashanti,Ashanti,1,55,2002,,ashanti,,"AJM Records, Harmony, I.G. Records, Inc.",2002,True,False,r&b,r&b,False,True
Believe,Disturbed,1,53,2002,,disturbed,,"Parole Records, Reprise Records, Warner Music Canada",2002,True,False,,,False,True
Come Away With Me,Norah Jones,1,165,2002,,norah jones,,"Analogue Productions, BMG Direct Marketing, Inc., Blue Note",2002,True,False,,,False,True
Juslisen (Just Listen),Musiq,1,35,2002,,musiq,,,2002,True,False,,,True,False
"No Shoes, No Shirt, No Problems",Kenny Chesney,1,104,2002,,kenny chesney,,"BMG, BNA Records Label",2002,True,False,country,country,False,True
B2K,B2K,2,33,2002,,b2k,,"Epic, [no label]",2002,True,False,,,False,True
Justified,Justin Timberlake,2,84,2002,,justin timberlake,,"BMG, BMG Direct Marketing, Inc., Jive",2002,True,False,,,False,True
Let Go,Avril Lavigne,2,98,2002,,avril lavigne,,"Arista, BMG, BMG Brasil Ltda.",2002,True,False,,,False,True
The Best Of Both Worlds,Jay-Z,2,17,2002,R. Kelly & Jay-Z,jay-z,,,2002,True,False,,,False,True
Fever,Kylie Minogue,3,44,2002,,kylie minogue,,"BMG Direct Marketing, Inc., Capitol Records, EMI",2002,True,False,"dance-pop, funky house, nu-disco","dance-pop, funky house",True,False
God's Favorite,N.O.R.E.,3,16,2002,,n.o.r.e.,,,2002,True,False,,,True,False
Life Goes On,Donell Jones,3,19,2002,,donell jones,,Arista,2002,True,False,,,True,False
Man vs Machine,Xzibit,3,12,2002,,xzibit,,"Columbia, Goliath Artists, Loud Records",2002,True,False,hip hop,hip hop,True,False
Under Construction,Missy Elliott,3,36,2002,,missy elliott,,"ATG, Atlantic, EEG Music",2002,True,False,,,False,True
18,Moby,4,18,2002,,moby,,"Everlasting Records, Labels, Little Idiot",2002,True,False,,,True,False
Gutterflower,Goo Goo Dolls,4,25,2002,,goo goo dolls,,Warner Bros. Records,2002,True,False,"rock, pop","rock, pop",False,True
Lord Willin',Clipse,4,31,2002,,clipse,,Star Trak,2002,True,False,,,False,True
Sticks And Stones,New Found Glory,4,39,2002,,new found glory,,"BMG Direct, Bridge Nine Records, Drive‐Thru Records",2002,True,False,punk,punk,False,True
World Outside My Window,Glenn Lewis,4,14,2002,,glenn lewis,,Epic,2002,True,False,,,True,False
A Rush Of Blood To The Head,Coldplay,5,108,2002,,coldplay,,"Atlantic, BMG Direct Marketing, Inc., Capitol Records",2002,True,False,,,False,True
Be Not Nobody,Vanessa Carlton,5,51,2002,,vanessa carlton,,"A&M Records, Polydor, Real Gone Music",2002,True,False,,,True,False
Melt,Rascal Flatts,5,104,2002,,rascal flatts,,Lyric Street Records,2002,True,False,"country, modern country",country,False,True
Truthfully Speaking,Truth Hurts,5,14,2002,,truth hurts,,"Aftermath Entertainment, Aftermath Records, Interscope Records",2002,True,False,"hip hop, r&b","hip hop, r&b",True,False
Ecstasy,Avant,6,30,2002,,avant,,"Geffen Records, MCA Records",2002,True,False,,,False,True
Audioslave,Audioslave,7,103,2002,,audioslave,,"Chrome Dreams, Epic, Interscope Records",2002,True,False,"alternative rock, hard rock, post-grunge, alternative metal, pop rock","alternative rock, hard rock, post-grunge, alternative metal, pop rock",False,True
Dirty Vegas,Dirty Vegas,7,19,2002,,dirty vegas,,"Capitol Records, EMI, New State Music",2002,True,False,,,True,False
The Young And The Hopeless,Good Charlotte,7,95,2002,,good charlotte,,"BMG Direct Marketing, Inc., Daylight, Epic",2002,True,False,alternative rock,alternative rock,False,True
Sea Change,Beck,8,26,2002,,beck,,"DGC Records, Geffen Records, Interscope Records",2002,True,False,,,False,True
All I Have,Amerie,9,29,2002,,amerie,,"Columbia, Sony Records International",2002,True,False,,,False,True
Dutty Rock,Sean Paul,9,85,2002,,sean paul,,"Atlantic, Rhino Atlantic, Spinnin’ Records",2002,True,False,,,False,True
Gravity,Our Lady Peace,9,27,2002,,our lady peace,,"Columbia, Epic",2002,True,False,,,True,False
Mario,Mario,9,20,2002,,mario,,"100 Hits, 101 South Records, A45 Music",2002,True,False,,,False,True
Pandemonium!,B2K,10,35,2002,,b2k,,"Epic, T.U.G. Entertainment",2002,True,False,,,False,True
Things In The Game Done Changed,Dave Hollister,10,7,2002,,dave hollister,,Motown,2002,True,False,,,True,False
Dangerously In Love,Beyonce,1,102,2003,,beyonce,,,2003,True,False,,,False,True
Get Rich Or Die Tryin',50 Cent,1,268,2003,,50 cent,,"Aftermath Entertainment, ChopNotSlop Ent., Interscope Records",2003,True,False,hip hop,hip hop,False,True
Measure Of A Man,Clay Aiken,1,35,2003,,clay aiken,,"19 Recordings, BMG, RCA",2003,True,False,,,False,True
Metamorphosis,Hilary Duff,1,77,2003,,hilary duff,,"Buena Vista Records, Hollywood Records",2003,True,False,,,False,True
Soulful,Ruben Studdard,1,27,2003,,ruben studdard,,J Records,2003,True,False,r&b,r&b,False,True
Thankful,Kelly Clarkson,1,50,2003,,kelly clarkson,,"19 Recordings, BMG, BMG Canada",2003,True,False,pop,pop,False,True
"A Mark, A Mission, A Brand, A Scar",Dashboard Confessional,2,35,2003,,dashboard confessional,,"Hidden Note Records, Vagrant Records",2003,True,False,,,False,True
Beg For Mercy,G Unit,2,41,2003,,g unit,,,2003,True,False,,,False,True
Hotel Paper,Michelle Branch,2,33,2003,,michelle branch,,"Gallo, Maverick",2003,True,False,,,True,False
Jackpot,Chingy,2,56,2003,,chingy,,Capitol Records,2003,True,False,,,False,True
Some Devil,Dave Matthews,2,22,2003,,dave matthews,,"BMG, Bama Rags, Just Music",2003,True,False,,,True,False
The New Breed,50 Cent,2,17,2003,,50 cent,,"Aftermath Entertainment, G Unit, Interscope Records",2003,True,False,"hip hop, gangsta rap","hip hop, gangsta rap",False,True
Too Hot For T.V.,Bad Boy's Da Band,2,9,2003,,bad boy's da band,,,2003,True,False,,,True,False
Bow Wow: Unleashed,Bow Wow,3,25,2003,,bow wow,,,2003,True,False,,,False,True
Fallen,Evanescence,3,121,2003,,evanescence,,"Craft Recordings, Epic, Sony Music",2003,True,False,,,False,True
Mary Star Of The Sea,Zwan,3,11,2003,,zwan,,"Martha’s Music, Reprise Records",2003,True,False,,,True,False
Moodring,Mya,3,18,2003,,mya,,,2003,True,False,,,True,False
On And On,Jack Johnson,3,55,2003,,jack johnson,,"Brushfire Records, Island, Jack Johnson LP3",2003,True,False,"rock, pop, alternative rock, indie rock, indie pop, alternative pop","rock, pop, alternative rock, indie rock, indie pop, alternative pop",False,True
Seal IV,Seal,3,42,2003,,seal,,Warner Bros. Records,2003,True,False,,,False,True
The Reason,Hoobastank,3,68,2003,,hoobastank,,"Dim Mak Records, Island, Island Mercury",2003,True,False,alternative rock,alternative rock,True,False
Year Of The Spider,Cold,3,21,2003,,cold,,"Flip Records, Geffen Records",2003,True,False,,,True,False
Bare,Annie Lennox,4,20,2003,,annie lennox,,"19 Recordings, BMG, BMG Japan",2003,True,False,pop,pop,False,True
Have You Forgotten?,Darryl Worley,4,22,2003,,darryl worley,,"DreamWorks Nashville Records, DreamWorks Records",2003,True,False,,,True,False
Room On Fire,The Strokes,4,13,2003,,the strokes,,"BMG, BMG Australia, BMG Canada",2003,True,False,,,False,True
Strays,Jane's Addiction,4,10,2003,,jane's addiction,,,2003,True,False,,,True,False
Cheers,Obie Trice,5,22,2003,,obie trice,,"Interscope Records, Shady Records",2003,True,False,hip hop,hip hop,False,True
Drankin' Patnaz,YoungBloodZ,5,23,2003,,youngbloodz,,,2003,True,False,,,True,False
Philadelphia Freeway,Freeway,5,14,2003,,freeway,,"Real Talk Entertainment, Roc‐A‐Fella Records",2003,True,False,,,True,False
Sing The Sorrow,AFI,5,51,2003,,afi,,"Adeline Records, BMG Direct, DreamWorks Records",2003,True,False,,,False,True
To Whom It May Concern,Lisa Marie Presley,5,18,2003,,lisa marie presley,,Capitol Records,2003,True,False,,,False,True
Elephant,The White Stripes,6,58,2003,,the white stripes,,"Analogue Productions, Legacy, Remote Control",2003,True,False,"alternative rock, blues rock, garage rock revival","alternative rock, blues rock, garage rock revival",False,True
Songs About Jane,Maroon 5,6,158,2003,,maroon 5,,"A&M Records, A&M/Octone Records, BMG Brasil Ltda.",2003,True,False,,,False,True
War All The Time,Thursday,7,9,2003,,thursday,,"Equal Vision Records, Island, Island Mercury",2003,True,False,,,True,False
Da Skool Boy Presents Murphy's Law,Murphy Lee,8,29,2003,,murphy lee,,Universal Records,2003,True,False,,,True,False
Diplomatic Immunity,Cam'Ron Presents The Diplomats,8,18,2003,,cam'ron presents the diplomats,,,2003,True,False,,,True,False
From Me To U,Juelz Santana,8,8,2003,,juelz santana,,Roc‐A‐Fella Records,2003,True,False,hip hop,hip hop,False,True
Joe Budden,Joe Budden,8,16,2003,,joe budden,,"Amalgam Entertainment, Def Jam Recordings, On the Low Records",2003,True,False,,,True,False
Mud On The Tires,Brad Paisley,8,104,2003,,brad paisley,,Arista Nashville,2003,True,False,,,False,True
The Dreamer,Blake Shelton,8,12,2003,,blake shelton,,Warner Bros. Records,2003,True,False,,,False,True
"Greatest Hits Collection, Volume I",Trace Adkins,9,24,2003,,trace adkins,,Capitol Records Nashville,2003,True,False,,,False,True
Mississippi: The Album,David Banner,9,22,2003,,david banner,,"Republic Records, Street Records Corporation, Universal Records",2003,True,False,,,False,True
Walk Witt Me,Sheek Louch,9,6,2003,,sheek louch,,,2003,True,False,,,True,False
Monster,Killer Mike,10,10,2003,,killer mike,,"Aquemini Records, Columbia",2003,True,False,,,True,False
Wave On Wave,Pat Green,10,24,2003,,pat green,,"BMG Direct, Republic Records, Universal South",2003,True,False,,,True,False
Autobiography,Ashlee Simpson,1,40,2004,,ashlee simpson,,"BMG Direct Marketing, Inc., Geffen Records, Polydor",2004,True,False,,,False,True
Contraband,Velvet Revolver,1,51,2004,,velvet revolver,,"BMG, Legacy, Music on CD",2004,True,False,,,False,True
Kamikaze,Twista,1,37,2004,,twista,,Atlantic,2004,True,False,hip hop,hip hop,False,True
MTV Ultimate Mash-Ups Presents: Collision Course,Jay-Z/Linkin Park,1,26,2004,,jay-z/linkin park,,,2004,True,False,,,True,False
The Hunger For More,Lloyd Banks,1,36,2004,,lloyd banks,,"G Unit, Interscope Records",2004,True,False,"hip hop, gangsta rap","hip hop, gangsta rap",False,True
Here For The Party,Gretchen Wilson,2,102,2004,,gretchen wilson,,"Epic, Redneck Records",2004,True,False,,,False,True
Hurt No More,Mario Winans,2,17,2004,,mario winans,,"Bad Boy Entertainment, Bad Boy Records",2004,True,False,,,True,False
Split Personality,Cassidy,2,15,2004,,cassidy,,"BMG, ETalent Management & Entertainment, Full Surface Records",2004,True,False,hip hop,hip hop,False,True
Be Here,Keith Urban,3,104,2004,,keith urban,,"BMG Direct, Capitol Records, Capitol Records Nashville",2004,True,False,,,False,True
Beautifully Human: Words And Sounds Vol. 2,Jill Scott,3,27,2004,,jill scott,,Hidden Beach Recordings,2004,True,False,"r&b, neo soul","r&b, neo soul",False,True
Crunk Juice,Lil Jon & The East Side Boyz,3,41,2004,,lil jon & the east side boyz,,"BME Recordings, TVT Records, The Orchard",2004,True,False,,,True,False
Goodies,Ciara,3,71,2004,,ciara,,"BMG Brasil Ltda., BMG Japan, LaFace Records",2004,True,False,,,False,True
Still Not Getting Any...,Simple Plan,3,49,2004,,simple plan,,,2004,True,False,,,True,False
Straight Outta Ca$hville,Young Buck,3,29,2004,,young buck,,"G Unit, Interscope Records",2004,True,False,hip hop,hip hop,False,True
Tough Luv,Young Gunz,3,11,2004,,young gunz,,"Def Jam Recordings, Roc‐A‐Fella Records",2004,True,False,,,True,False
Where You Want To Be,Taking Back Sunday,3,26,2004,,taking back sunday,,"Craft Recordings, Victory Records",2004,True,False,,,False,True
Speak,Lindsay Lohan,4,24,2004,,lindsay lohan,,"Casablanca, Universal Records",2004,True,False,,,True,False
Still Writing In My Diary: 2nd Entry,Petey Pablo,4,22,2004,,petey pablo,,Jive,2004,True,False,,,True,False
The Hard Way,213,4,13,2004,,213,,"Dogg Foundation, Doggy Style Records, G-Funk Entertainment",2004,True,False,,,True,False
U Gotta Feel Me,Lil' Flip,4,31,2004,,lil' flip,,,2004,True,False,,,True,False
Love. Angel. Music. Baby.,Gwen Stefani,5,78,2004,,gwen stefani,,"BMG Direct Marketing, Inc., Interscope Records",2004,True,False,,,False,True
