title,performer,peak_pos,wks_on_chart,first_charting_year,original_performer,performer_normalized,original_performer_normalized,label,first_year_top_10_albums,first_top_10_album,precedes_first_top_10_album,tags,genre_tags_musicbrainz,top_10_1hit_wonder_album,top_10_hitmaker_album
The One That You Love,Air Supply,10,60,1981,,air supply,,"Arista, Big Time Phonograph Recording Co., Big Time Records",1981,True,False,,,False,True
American Fool,John Cougar,1,106,1982,,john cougar,,,1982,True,False,,,True,False
Asia,Asia,1,64,1982,,asia,,"213 Records, 550 Music, AFM Records",1982,True,False,,,False,True
Business As Usual,Men At Work,1,90,1982,,men at work,,"CBS, Columbia, Epic",1982,True,False,,,False,True
Always On My Mind,Willie Nelson,2,99,1982,,willie nelson,,"CBS, Columbia, Columbia Nashville",1982,True,False,,,False,True
Built For Speed,Stray Cats,2,74,1982,,stray cats,,"Arista, BMG, Capitol Records",1982,True,False,,,True,False
Eye Of The Tiger,Survivor,2,41,1982,,survivor,,"BMG Japan, Bellaphon, CANYON",1982,True,False,,,True,False
Dare,The Human League,3,38,1982,,the human league,,"A&M Records, Caroline Records, EMI United Kingdom",1982,True,False,,,True,False
Lionel Richie,Lionel Richie,3,140,1982,,lionel richie,,"Motown, NBC, RCA",1982,True,False,,,False,True
Night And Day,Joe Jackson,4,57,1982,,joe jackson,,"A&M Records, BMG Direct Marketing, Inc., Chronicles",1982,True,False,,,True,False
Pictures At Eleven,Robert Plant,5,53,1982,,robert plant,,"EastWest Japan, Es Paranza, Rhino",1982,True,False,,,False,True
If That's What It Takes,Michael McDonald,6,32,1982,,michael mcdonald,,"Flashback Records, Mobile Fidelity Sound Lab, Warner Bros. Records",1982,True,False,,,False,True
Rio,Duran Duran,6,128,1982,,duran duran,,"BMG Direct Marketing, Inc., Bertelsmann Club, Capitol Records",1982,True,False,,,False,True
The Concert In Central Park,Simon And Garfunkel,6,34,1982,,simon and garfunkel,,,1982,True,False,,,True,False
1999,Prince,7,163,1982,,prince,,"BMG Direct, Legacy, Masterpiece",1982,True,False,,,False,True
Combat Rock,The Clash,7,62,1982,,the clash,,"CBS, CBS/Sony, Columbia",1982,True,False,,,True,False
Aldo Nova,Aldo Nova,8,50,1982,,aldo nova,,"Acadia, Epic, Legacy",1982,True,False,,,True,False
A Flock Of Seagulls,A Flock Of Seagulls,10,50,1982,,a flock of seagulls,,"Alfa, Arista, BMG",1982,True,False,,,True,False
Blackout,Scorpions,10,74,1982,,scorpions,,"2DF.enterprises, Audio Fidelity, BMG",1982,True,False,"rock, metal, hard rock","rock, metal, hard rock",False,True
Special Forces,38 Special,10,42,1982,,38 special,,"A&M Records, Rock Candy",1982,True,False,,,True,False
Metal Health,Quiet Riot,1,81,1983,,quiet riot,,"CBS/Sony, Epic, Legacy",1983,True,False,,,True,False
Sports,Huey Lewis & The News,1,160,1983,,huey lewis & the news,,,1983,True,False,,,False,True
Colour By Numbers,Culture Club,2,59,1983,,culture club,,"Daily Mail, EMI Marketing, Epic",1983,True,False,"pop, rock","pop, rock",True,False
Pyromania,Def Leppard,2,124,1983,,def leppard,,"BMG Direct Marketing, Inc., Bludgeon Riffola, Mercury Records",1983,True,False,"rock, hair metal",rock,False,True
What's New,The Nelson Riddle Orchestra,3,80,1983,Linda Ronstadt & The Nelson Riddle Orchestra,the nelson riddle orchestra,,,1983,True,False,,,True,False
Faster Than The Speed Of Night,Bonnie Tyler,4,32,1983,,bonnie tyler,,"CBS, Carbon Music & Entertainment, Columbia",1983,True,False,,,True,False
She's So Unusual: A 30th Anniversary Celebration,Cyndi Lauper,4,97,1983,,cyndi lauper,,Epic,1983,True,False,,,False,True
Rebel Yell,Billy Idol,6,82,1983,,billy idol,,"Audio Fidelity, Capitol Records, Chrysalis",1983,True,False,,,False,True
Break Out,The Pointer Sisters,8,105,1983,,the pointer sisters,,"Big Break Records, Legacy, Planet",1983,True,False,,,True,False
Cuts Like A Knife,Bryan Adams,8,89,1983,,bryan adams,,"A&M Records, Audio Fidelity, BMG Direct Marketing, Inc.",1983,True,False,,,False,True
Madonna,Madonna,8,168,1983,,madonna,,"1-800-Harmony, Action Replay Records, BMG Direct Marketing, Inc.",1983,True,False,,,False,True
Reach The Beach,The Fixx,8,54,1983,,the fixx,,"Geffen Records, MCA Records",1983,True,False,,,True,False
Eddie & The Cruisers (Soundtrack),John Cafferty & The Beaver Brown Band,9,55,1983,,john cafferty & the beaver brown band,,,1983,True,False,,,True,False
Uh Huh,John Mellencamp,9,66,1983,,john mellencamp,,,1983,True,False,,,False,True
Killer On The Rampage,Eddy Grant,10,30,1983,,eddy grant,,"CMC, ICE, Polydor",1983,True,False,,,True,False
The Closer You Get,Alabama,10,70,1983,,alabama,,"RCA, RCA Nashville, RCA Victor",1983,True,False,,,True,False
Make It Big,Wham!,1,87,1984,,wham!,,"Columbia, Columbia House Canada, Epic",1984,True,False,,,False,True
Purple Rain (Soundtrack),Prince And The Revolution,1,173,1984,,prince and the revolution,,,1984,True,False,,,False,True
Victory,Jacksons,4,30,1984,,jacksons,,"Epic, Legacy, Sony Music",1984,True,False,,,True,False
Volume One,The Honeydrippers,4,31,1984,,the honeydrippers,,"Es Paranza, Rhino, Warner Music Australia",1984,True,False,,,True,False
1100 Bel Air Place,Julio Iglesias,5,34,1984,,julio iglesias,,"CBS, Columbia",1984,True,False,,,True,False
New Edition,New Edition,6,54,1984,,new edition,,"BMG Direct Marketing, Inc., Geffen Records, MCA Records",1984,True,False,r&b,r&b,False,True
Out Of The Cellar,Ratt,7,56,1984,,ratt,,"Atlantic, Flashback Records, Rock Candy",1984,True,False,glam metal,glam metal,False,True
Touch,Eurythmics,7,43,1984,,eurythmics,,"Arista, Legacy, RCA",1984,True,False,,,False,True
Suddenly,Billy Ocean,9,86,1984,,billy ocean,,"Arista, CBS/Sony, Carrère",1984,True,False,,,False,True
Into The Gap,Thompson Twins,10,53,1984,,thompson twins,,"Arista, BMG, BMG Japan",1984,True,False,,,True,False
No Brakes,John Waite,10,43,1984,,john waite,,"Beat Goes On Records, EMI America, One Way Records",1984,True,False,,,True,False
Centerfield,John Fogerty,1,51,1985,,john fogerty,,"BMG, Bellaphon, CD‐Maximum",1985,True,False,,,False,True
Promise,Sade,1,46,1985,,sade,,"Audio Fidelity, CBS/Sony, CrusaderBeach",1985,True,False,"pop, jazz, vocal jazz","pop, jazz, vocal jazz",False,True
Songs From The Big Chair,Tears For Fears,1,82,1985,,tears for fears,,"BMG Direct Marketing, Inc., Mercury Records, Mobile Fidelity Sound Lab",1985,True,False,,,False,True
We Are The World,USA For Africa,1,22,1985,,usa for africa,,"CBS, Columbia, Happinet",1985,True,False,,,True,False
Welcome To The Real World,Mr. Mister,1,58,1985,,mr. mister,,"BMG Direct Marketing, Inc., Dünya Plak, Eagle Records",1985,True,False,"rock, electronic, pop, synth-pop, pop rock","rock, electronic, pop, synth-pop, pop rock",True,False
Whitney Houston,Whitney Houston,1,176,1985,,whitney houston,,"Arista, Arista Records, LLC, BMG Direct Marketing, Inc.",1985,True,False,r&b,r&b,False,True
The Dream Of The Blue Turtles,Sting,2,58,1985,,sting,,"A&M Records, A&M Records, Inc., BMG Direct Marketing, Inc.",1985,True,False,,,False,True
Diamond Life,Sade,5,81,1985,,sade,,"Audio Fidelity, Epic, Portrait",1985,True,False,,,False,True
The Power Station,The Power Station,6,44,1985,,the power station,,"BMG Direct Marketing, Inc., Capitol Records, EMI",1985,True,False,,,True,False
Theatre Of Pain,Motley Crue,6,72,1985,,motley crue,,,1985,True,False,,,False,True
Knee Deep In The Hoopla,Starship,7,50,1985,,starship,,"BMG, BMG Japan, Grunt",1985,True,False,,,True,False
Riptide,Robert Palmer,8,90,1985,,robert palmer,,"BMG Direct, Culture Factory, Island",1985,True,False,,,True,False
Play Deep,The Outfield,9,66,1985,,the outfield,,"CBS, CBS/Sony, Columbia",1985,True,False,power pop,power pop,True,False
7 Wishes,Night Ranger,10,45,1985,,night ranger,,"Camel Records Inc., Geffen Records, MCA Records",1985,True,False,,,True,False
Dream Into Action,Howard Jones,10,45,1985,,howard jones,,"Cherry Red Records, DTox, Elektra",1985,True,False,,,True,False
Once Upon A Time,Simple Minds,10,42,1985,,simple minds,,"A&M Records, BMG Rights Management, Daily Mail",1985,True,False,,,True,False
Rock Me Tonight,Freddie Jackson,10,62,1985,,freddie jackson,,Capitol Records,1985,True,False,"smooth jazz, slow jam, r&b","smooth jazz, r&b",True,False
Control,Janet Jackson,1,106,1986,,janet jackson,,"A&M Records, BMG Direct Marketing, Inc., Breakout",1986,True,False,"pop, r&b","pop, r&b",False,True
Licensed To Ill,Beastie Boys,1,152,1986,,beastie boys,,"BMG Direct Marketing, Inc., Columbia, Def Jam Recordings",1986,True,False,,,False,True
Slippery When Wet,Bon Jovi,1,118,1986,,bon jovi,,"BMG Direct Marketing, Inc., Bon Jovi Profit Split, Brave Mood Records",1986,True,False,,,False,True
Different Light,The Bangles,2,82,1986,,the bangles,,"CBS, CBS/Sony, Cherry Pop",1986,True,False,,,True,False
So,Peter Gabriel,2,93,1986,,peter gabriel,,"Charisma, Classic Records, Geffen Records",1986,True,False,,,False,True
Falco 3,Falco,3,27,1986,,falco,,"A&M Records, Ariola, BMG",1986,True,False,,,True,False
Look What The Cat Dragged In,Poison,3,101,1986,,poison,,"CBS/Sony, Capitol Records, Enigma",1986,True,False,glam metal,glam metal,False,True
Night Songs,Cinderella,3,70,1986,,cinderella,,"BMG Direct, Bad Reputation, Friday Music",1986,True,False,,,False,True
Raising Hell,Run-D.M.C.,3,71,1986,,run-d.m.c.,,,1986,True,False,,,False,True
The Way It Is,Bruce Hornsby & The Range,3,73,1986,,bruce hornsby & the range,,"BMG, BMG Music Canada Inc., Legacy",1986,True,False,"rock, soft rock","rock, soft rock",False,True
Eat 'Em And Smile,David Lee Roth,4,36,1986,,david lee roth,,Warner Bros. Records,1986,True,False,,,False,True
Georgia Satellites,The Georgia Satellites,5,42,1986,,the georgia satellites,,"BMG Direct Marketing, Inc., Columbia House, Elektra",1986,True,False,southern rock,southern rock,True,False
Duotones,Kenny G,6,102,1986,,kenny g,,"Arista, BMG Direct Marketing, Inc.",1986,True,False,,,False,True
"Life, Love And Pain",Club Nouveau,6,44,1986,,club nouveau,,,1986,True,False,,,True,False
The Ultimate Sin,Ozzy Osbourne,6,39,1986,,ozzy osbourne,,"CBS, CBS Associated Records, CBS/Sony",1986,True,False,heavy metal,heavy metal,False,True
Please,Pet Shop Boys,7,31,1986,,pet shop boys,,"EMI, EMI America, Gala Records",1986,True,False,,,True,False
The Final Countdown,Europe,8,78,1986,,europe,,"Camden, Del Imaginario Discos, Epic",1986,True,False,,,True,False
Word Up,Cameo,8,54,1986,,cameo,,"Atlanta Artists, Casablanca Records, Club",1986,True,False,,,True,False
Appetite For Destruction,Guns N' Roses,1,261,1987,,guns n' roses,,,1987,True,False,,,False,True
Faith,George Michael,1,96,1987,,george michael,,"Aegean, BMG Direct, CBS",1987,True,False,,,False,True
The Joshua Tree,U2,1,121,1987,,u2,,"BMG Direct, BMG Direct Marketing, Inc., Columbia House",1987,True,False,,,False,True
Tiffany,Tiffany,1,69,1987,,tiffany,,"1080p, Columbia, Jugoton",1987,True,False,,,True,False
Whitesnake,Whitesnake,2,76,1987,,whitesnake,,"BMG Direct Marketing, Inc., CBS/Sony, Carrère",1987,True,False,,,False,True
Bigger And Deffer,LL Cool J,3,53,1987,,ll cool j,,"Columbia, Def Jam Recordings",1987,True,False,,,False,True
Kick,INXS,3,81,1987,,inxs,,"Analogue Productions, Atlantic, BMG Direct",1987,True,False,,,False,True
Indtroducing The Hardline According To Terence Trent D'Arby,Terence Trent D'Arby,4,60,1987,,terence trent d'arby,,,1987,True,False,,,True,False
In The Dark,Grateful Dead,6,34,1987,,grateful dead,,"Arista, Grateful Dead Records, Mobile Fidelity Sound Lab",1987,True,False,,,True,False
Let It Loose,Gloria Estefan,6,97,1987,Gloria Estefan & Miami Sound Machine,gloria estefan,,Epic,1987,True,False,,,False,True
Let It Loose,Miami Sound Machine,6,97,1987,Gloria Estefan & Miami Sound Machine,miami sound machine,,Epic,1987,True,False,,,True,False
Tribute,Ozzy Osbourne/Randy Rhoads,6,23,1987,,ozzy osbourne/randy rhoads,,,1987,True,False,,,True,False
Out Of The Blue,Debbie Gibson,7,89,1987,,debbie gibson,,"Atlantic, Cherry Pop, Columbia House",1987,True,False,,,False,True
Who's That Girl,Soundtrack-Madonna,7,28,1987,,soundtrack-madonna,,,1987,True,False,,,True,False
Crushin',Fat Boys,8,49,1987,,fat boys,,,1987,True,False,,,True,False
Richard Marx,Richard Marx,8,86,1987,,richard marx,,"Capitol Records, Chrysalis Music Group USA, EMI USA",1987,True,False,,,False,True
Document,R.E.M.,10,33,1987,,r.e.m.,,"BMG Direct Marketing, Inc., CBS/Sony, Capitol Music",1987,True,False,,,False,True
Jody Watley,Jody Watley,10,74,1987,,jody watley,,MCA Records,1987,True,False,,,True,False
Don't Be Cruel,Bobby Brown,1,97,1988,,bobby brown,,MCA Records,1988,True,False,"new jack swing, r&b","new jack swing, r&b",False,True
Forever Your Girl,Paula Abdul,1,175,1988,,paula abdul,,"BMG Direct Marketing, Inc., Siren Records, Virgin",1988,True,False,,,False,True
Giving You The Best That I Got,Anita Baker,1,42,1988,,anita baker,,"Elektra, Jugoton, Magnasound",1988,True,False,"rock, pop, jazz, soul jazz, r&b","rock, pop, jazz, soul jazz, r&b",False,True
Hangin' Tough,New Kids On The Block,1,134,1988,,new kids on the block,,"CBS/Sony, CMV Enterprises, Columbia",1988,True,False,,,False,True
Tracy Chapman,Tracy Chapman,1,64,1988,,tracy chapman,,"AMIGA, BMG Direct Marketing, Inc., Elektra",1988,True,False,blues rock,blues rock,False,True
Traveling Wilburys,Traveling Wilburys,3,53,1988,,traveling wilburys,,"BMG Direct, CD‐Maximum, Concord Bicycle Music",1988,True,False,,,False,True
"He's The D.J., I'm The Rapper",D.J. Jazzy Jeff & The Fresh Prince,4,55,1988,,d.j. jazzy jeff & the fresh prince,,,1988,True,False,,,True,False
Shooting Rubberbands At The Stars,Edie Brickell & New Bohemians,4,54,1988,,edie brickell & new bohemians,,"BMG Direct Marketing, Inc., Geffen Records, Victor",1988,True,False,,,True,False
Simple Pleasures,Bobby McFerrin,5,55,1988,,bobby mcferrin,,EMI Manhattan,1988,True,False,vocal jazz,vocal jazz,True,False
...And Justice For All,Metallica,6,123,1988,,metallica,,,1988,True,False,,,False,True
Vivid,Living Colour,6,76,1988,,living colour,,"BMG Direct, BMG Direct Marketing, Inc., Epic",1988,True,False,,,True,False
Any Love,Luther Vandross,9,33,1988,,luther vandross,,Epic,1988,True,False,soul,soul,False,True
Whenever You Need Somebody,Rick Astley,10,60,1988,,rick astley,,"2000 FruitGum, BMG, Edsel Records",1988,True,False,,,True,False
Girl You Know It's True,Milli Vanilli,1,78,1989,,milli vanilli,,"Ariola Express, Arista, BMG",1989,True,False,,,True,False
Loc-ed After Dark,Tone-Loc,1,42,1989,,tone-loc,,,1989,True,False,,,True,False
Nick Of Time,Bonnie Raitt,1,185,1989,,bonnie raitt,,"BMG Direct Marketing, Inc., Capitol Records, DCC Compact Classics",1989,True,False,"rock, blues rock, americana","rock, blues rock, americana",False,True
The Raw & The Cooked,Fine Young Cannibals,1,63,1989,,fine young cannibals,,"BMG Direct Marketing, Inc., Edsel Records, FFRR",1989,True,False,,,True,False
Full Moon Fever,Tom Petty,3,77,1989,,tom petty,,"BMG Direct Marketing, Inc., Geffen Records, MCA Records",1989,True,False,,,False,True
Soul Provider,Michael Bolton,3,202,1989,,michael bolton,,"CBS, Camden Deluxe, Columbia",1989,True,False,,,False,True
Cosmic Thing,The B-52s,4,65,1989,,the b-52s,,,1989,True,False,,,True,False
Straight Outta Compton,N.W.A,4,110,1989,,n.w.a,,"Capitol Records, EMI, EMI Music Canada",1989,True,False,"gangsta rap, hip hop, west coast hip hop","gangsta rap, hip hop, west coast hip hop",False,True
Mystery Girl,Roy Orbison,5,28,1989,,roy orbison,,"BMG Direct, EMI Music South Africa, Legacy",1989,True,False,,,True,False
Skid Row,Skid Row,6,78,1989,,skid row,,"Acadia, Atlantic, BMG Direct Marketing, Inc.",1989,True,False,,,False,True
"Cry Like A Rainstorm, Howl Like The Wind",Linda Ronstadt (Featuring Aaron Neville),7,58,1989,,linda ronstadt (featuring aaron neville),,,1989,True,False,,,True,False
Heart Shaped World,Chris Isaak,7,74,1989,,chris isaak,,"BMG Direct Marketing, Inc., Mailboat Records, Primary Wave",1989,True,False,,,True,False
The End Of The Innocence,Don Henley,8,148,1989,,don henley,,"BMG Direct Marketing, Inc., DTS Entertainment, Geffen Records",1989,True,False,,,False,True
Stone Cold Rhymin',Young M.C.,9,48,1989,,young m.c.,,,1989,True,False,,,True,False
Twice Shy,Great White,9,50,1989,,great white,,"BMG Direct Marketing, Inc., Capitol Records, Relayer Music",1989,True,False,,,True,False
Dirty Rotten Filthy Stinking Rich,Warrant,10,65,1989,,warrant,,"CBS, CBS/Sony, CMV Enterprises",1989,True,False,,,False,True
Pump Up The Jam - The Album,Technotronic,10,55,1989,,technotronic,,,1989,True,False,,,True,False
Sonic Temple,The Cult,10,33,1989,,the cult,,"BMG Direct Marketing, Inc., Beggars Banquet, Reprise Records",1989,True,False,,,True,False
I Do Not Want What I Haven't Got,Sinead O'Connor,1,52,1990,,sinead o'connor,,,1990,True,False,,,True,False
Mariah Carey,Mariah Carey,1,113,1990,,mariah carey,,"CBS, CBS/Sony, Columbia",1990,True,False,,,False,True
Please Hammer Don't Hurt 'Em,M.C. Hammer,1,108,1990,,m.c. hammer,,,1990,True,False,,,False,True
To The Extreme,Vanilla Ice,1,67,1990,,vanilla ice,,"Capitol Records, EMI, SBK Records",1990,True,False,hip hop,hip hop,True,False
Wilson Phillips,Wilson Phillips,2,125,1990,,wilson phillips,,"BMG Direct, BMG Direct Marketing, Inc., Capitol Records",1990,True,False,,,False,True
Blaze Of Glory/Young Guns II,Jon Bon Jovi,3,41,1990,,jon bon jovi,,,1990,True,False,,,True,False
No Fences,Garth Brooks,3,224,1990,,garth brooks,,"BMG Direct Marketing, Inc., Capitol Records, Capitol Records Nashville",1990,True,False,"darkened, cover art dmca'd",,False,True
The Simpsons Sing The Blues,The Simpsons,3,39,1990,,the simpsons,,"Geffen Goldline, Geffen Records",1990,True,False,,,True,False
Shake Your Money Maker,The Black Crowes,4,167,1990,,the black crowes,,"American Recordings, BMG Direct Marketing, Inc., Def American Recordings",1990,True,False,,,False,True
Alannah Myles,Alannah Myles,5,36,1990,,alannah myles,,"ARK 21, Atlantic, BMG Direct Marketing, Inc.",1990,True,False,,,True,False
Poison,Bell Biv DeVoe,5,77,1990,,bell biv devoe,,"BMG Direct Marketing, Inc., FP, Get On Down",1990,True,False,,,True,False
I'll Give All My Love To You,Keith Sweat,6,62,1990,,keith sweat,,Elektra,1990,True,False,,,False,True
Empire,Queensryche,7,129,1990,,queensryche,,,1990,True,False,,,False,True
Family Style,Vaughan Brothers,7,38,1990,,vaughan brothers,,"Analogue Productions, CBS Associated Records, Epic",1990,True,False,,,True,False
Violator,Depeche Mode,7,74,1990,,depeche mode,,"Alfa, BMG Direct Marketing, Inc., BMG Rights Management",1990,True,False,,,False,True
Johnny Gill,Johnny Gill,8,60,1990,,johnny gill,,"Atlantic, Chronicles, Motown",1990,True,False,,,True,False
Affection,Lisa Stansfield,9,39,1990,,lisa stansfield,,"Arista, BMG, BMG Direct",1990,True,False,,,True,False
Extreme II Pornograffitti,Extreme,10,75,1990,,extreme,,,1990,True,False,,,False,True
Fear Of A Black Planet,Public Enemy,10,27,1990,,public enemy,,"CBS, CBS/Sony, Columbia",1990,True,False,hip hop,hip hop,False,True
Nevermind,Nirvana,1,760,1991,,nirvana,,"BMG Direct Marketing, Inc., DGC Records, Empress Valley Supreme Disc",1991,True,False,"grunge, alternative rock, nsfw cover art","grunge, alternative rock",False,True
Death Certificate,Ice Cube,2,36,1991,,ice cube,,"DJ:, Fourth and Broadway Records, Interscope Records",1991,True,False,"hip hop, west coast hip hop","hip hop, west coast hip hop",False,True
Gonna Make You Sweat,C+C Music Factory,2,85,1991,,c+c music factory,,"Bonton, CBS, CBS/Sony",1991,True,False,"electronic, house, hip hop, hip house, contemporary r&b","electronic, house, hip hop, hip house, contemporary r&b",True,False
Blood Sugar Sex Magik,Red Hot Chili Peppers,3,97,1991,,red hot chili peppers,,"BMG Direct Marketing, Inc., Warner Bros. Records",1991,True,False,,,False,True
C.M.B.,Color Me Badd,3,77,1991,,color me badd,,"Columbia House, Giant, X5 Music Group",1991,True,False,new jack swing,new jack swing,True,False
Cooleyhighharmony,Boyz II Men,3,133,1991,,boyz ii men,,"Hip-OSelect, Motown, [no label]",1991,True,False,,,False,True
Diamonds And Pearls,The New Power Generation,3,47,1991,Prince And The New Power Generation,the new power generation,,"BMG Direct, Legacy, NPG Records",1991,True,False,,,False,True
MCMXC A.D.,Enigma,6,282,1991,,enigma,,"COOLPRICE, Charisma, Charisma Records America, Inc.",1991,True,False,new age,new age,False,True
Coolin' At The Playground Ya' Know!,Another Bad Creation,7,52,1991,,another bad creation,,,1991,True,False,,,True,False
Brand New Man,Brooks & Dunn,10,153,1991,,brooks,brooks & dunn,"Arista, Arista Nashville, BMG Direct",1991,True,False,country,country,False,True
Brand New Man,Brooks & Dunn,10,153,1991,,brooks,brooks & dunn,"Arista, Arista Nashville, BMG Direct",1991,True,False,country,country,False,True
Brand New Man,Brooks & Dunn,10,153,1991,,brooks,brooks & dunn,"Arista, Arista Nashville, BMG Direct",1991,True,False,country,country,False,True
Brand New Man,Brooks & Dunn,10,153,1991,,brooks,brooks & dunn,"Arista, Arista Nashville, BMG Direct",1991,True,False,country,country,False,True
Brand New Man,Brooks & Dunn,10,153,1991,,dunn,brooks & dunn,"Arista, Arista Nashville, BMG Direct",1991,True,False,country,country,False,True
Brand New Man,Brooks & Dunn,10,153,1991,,dunn,brooks & dunn,"Arista, Arista Nashville, BMG Direct",1991,True,False,country,country,False,True
Brand New Man,Brooks & Dunn,10,153,1991,,dunn,brooks & dunn,"Arista, Arista Nashville, BMG Direct",1991,True,False,country,country,False,True
Brand New Man,Brooks & Dunn,10,153,1991,,dunn,brooks & dunn,"Arista, Arista Nashville, BMG Direct",1991,True,False,country,country,False,True
Heart In Motion,Amy Grant,10,105,1991,,amy grant,,"A&M Records, Amy Grant Productions, EMI",1991,True,False,"contemporary christian, soft rock, pop rock, ccm, religious","contemporary christian, soft rock, pop rock",False,True
The Sky Is Crying,Stevie Ray Vaughan And Double Trouble,10,48,1991,,stevie ray vaughan,stevie ray vaughan and double trouble,"Analogue Productions, Epic, Mobile Fidelity Sound Lab",1991,True,False,,,True,False
The Sky Is Crying,Stevie Ray Vaughan And Double Trouble,10,48,1991,,stevie ray vaughan,stevie ray vaughan and double trouble,"Analogue Productions, Epic, Mobile Fidelity Sound Lab",1991,True,False,,,True,False
The Sky Is Crying,Stevie Ray Vaughan And Double Trouble,10,48,1991,,stevie ray vaughan,stevie ray vaughan and double trouble,"Analogue Productions, Epic, Mobile Fidelity Sound Lab",1991,True,False,,,True,False
The Sky Is Crying,Stevie Ray Vaughan And Double Trouble,10,48,1991,,stevie ray vaughan,stevie ray vaughan and double trouble,"Analogue Productions, Epic, Mobile Fidelity Sound Lab",1991,True,False,,,True,False
The Sky Is Crying,Stevie Ray Vaughan And Double Trouble,10,48,1991,,double trouble,stevie ray vaughan and double trouble,"Analogue Productions, Epic, Mobile Fidelity Sound Lab",1991,True,False,,,True,False
The Sky Is Crying,Stevie Ray Vaughan And Double Trouble,10,48,1991,,double trouble,stevie ray vaughan and double trouble,"Analogue Productions, Epic, Mobile Fidelity Sound Lab",1991,True,False,,,True,False
The Sky Is Crying,Stevie Ray Vaughan And Double Trouble,10,48,1991,,double trouble,stevie ray vaughan and double trouble,"Analogue Productions, Epic, Mobile Fidelity Sound Lab",1991,True,False,,,True,False
The Sky Is Crying,Stevie Ray Vaughan And Double Trouble,10,48,1991,,double trouble,stevie ray vaughan and double trouble,"Analogue Productions, Epic, Mobile Fidelity Sound Lab",1991,True,False,,,True,False
Some Gave All,Billy Ray Cyrus,1,97,1992,,billy ray cyrus,,"BMG Direct Marketing, Inc., Columbia House, Island Mercury",1992,True,False,,,False,True
Totally Krossed Out,Kris Kross,1,65,1992,,kris kross,,"Columbia, Ruffhouse Records",1992,True,False,hip hop,hip hop,True,False
Countdown To Extinction,Megadeth,2,58,1992,,megadeth,,"BMG Direct, BMG Direct Marketing, Inc., Capitol Records",1992,True,False,,,False,True
Ten,Pearl Jam,2,265,1992,,pearl jam,,"BMG, Epic, Epic Associated",1992,True,False,,,False,True
Wish,The Cure,2,27,1992,,the cure,,"BMG Direct, BMG Direct Marketing, Inc., Columbia House",1992,True,False,,,False,True
Pocket Full Of Kryptonite,Spin Doctors,3,115,1992,,spin doctors,,"Columbia House, Epic, Epic Associated",1992,True,False,,,True,False
As Ugly As They Wanna Be (EP),Ugly Kid Joe,4,34,1992,,ugly kid joe,,,1992,True,False,,,True,False
Wynonna,Wynonna,4,86,1992,,wynonna,,"Curb Records, MCA Records",1992,True,False,,,False,True
Temple Of The Dog,Temple Of The Dog,5,50,1992,,temple of the dog,,"A&M Records, BMG Direct Marketing, Inc., Music on Vinyl",1992,True,False,,,True,False
Dirt,Alice In Chains,6,104,1992,,alice in chains,,"ANGRY DINO, ChopNotSlop Ent., Cocomelos Records",1992,True,False,,,False,True
Pure Country (Soundtrack),George Strait,6,129,1992,,george strait,,,1992,True,False,,,False,True
Shorty The Pimp,Too $hort,6,21,1992,,too $hort,,"Dangerous Music, Jive",1992,True,False,hip hop,hip hop,False,True
What's The 411?,Mary J. Blige,6,59,1992,,mary j. blige,,"MCA Records, Uptown Records",1992,True,False,"hip hop, funk, soul, r&b","hip hop, funk, soul, r&b",False,True
3 Years 5 Months & 2 Days In The Life Of . . .,Arrested Development,7,76,1992,,arrested development,,,1992,True,False,,,True,False
Broken,Nine Inch Nails,7,30,1992,,nine inch nails,,"Atlantic, BMG Direct, BMG Records Africa",1992,True,False,,,False,True
Lose Control,Silk,7,47,1992,,silk,,"Elektra, Keia Records, Rhino",1992,True,False,,,True,False
Funky Divas,En Vogue,8,86,1992,,en vogue,,"BMG Direct Marketing, Inc., EastWest, EastWest Records America",1992,True,False,new jack swing,new jack swing,False,True
The Hard Way,Clint Black,8,41,1992,,clint black,,"RCA, RCA Nashville",1992,True,False,,,True,False
Wild Life,Slaughter,8,23,1992,,slaughter,,"BMG Direct Marketing, Inc., Capitol Records, Chrysalis",1992,True,False,,,True,False
Hard Or Smooth,Wreckx-N-Effect,9,34,1992,,wreckx-n-effect,,,1992,True,False,,,True,False
Mack Daddy,Sir Mix-A-Lot,9,61,1992,,sir mix-a-lot,,,1992,True,False,,,True,False
